,state_change_user_id,state_change_date,state,code,accountable_class_id,transaction_type_id,ledger_type_id
0,1,2022-10-25 20:09:31.599700+00:00,1,CA-Canon Mensual Arriendo Inmueble,33,Canon Mensual Arriendo Inmueble,Causación
1,1,2022-10-25 20:09:31.599735+00:00,1,FV-Canon Mensual Arriendo Inmueble,34,Canon Mensual Arriendo Inmueble,Factura de Venta
2,1,2022-10-25 20:09:31.599755+00:00,1,FV-Canon Mensual Arriendo Inmueble con IVA,34,Canon Mensual Arriendo Inmueble,Factura de Venta
3,1,2022-10-25 20:09:31.599773+00:00,1,RC-Canon Mensual Arriendo Inmueble-Efectivo,34,Canon Mensual Arriendo Inmueble,Recibo de Caja
4,1,2022-10-26 16:29:45.698361+00:00,1,RC-Canon Mensual Arriendo Inmueble con IVA-Efectivo,34,Canon Mensual Arriendo Inmueble,Recibo de Caja
5,1,2022-10-26 16:34:34.174461+00:00,1,RC-Canon Mensual Arriendo Inmueble con IVA y Retefuente-Efectivo,34,Canon Mensual Arriendo Inmueble,Recibo de Caja
